{
  "concept": "pragmatic-m-standard",
  "counts": {
    "ansi-unimplemented": 21,
    "core": 81,
    "iris-only": 127,
    "ydb-only": 94
  },
  "description": "The pragmatic M standard: the language surface that runs unmodified on both YottaDB and InterSystems IRIS. Filter to pragmatic_tier='core' for the portable subset suitable for cross-engine VistA development.",
  "entries": [
    {
      "anno_section": "pages/a108019.html#8.2.1",
      "concept": "commands",
      "in_anno": true,
      "in_iris": false,
      "in_ydb": false,
      "iris_section": "",
      "name": "ABLOCK",
      "pragmatic_tier": "ansi-unimplemented",
      "standard_status": "ansi",
      "ydb_section": ""
    },
    {
      "anno_section": "pages/a108020.html#8.2.2",
      "concept": "commands",
      "in_anno": true,
      "in_iris": false,
      "in_ydb": false,
      "iris_section": "",
      "name": "ASSIGN",
      "pragmatic_tier": "ansi-unimplemented",
      "standard_status": "ansi",
      "ydb_section": ""
    },
    {
      "anno_section": "pages/a108021.html#8.2.3",
      "concept": "commands",
      "in_anno": true,
      "in_iris": false,
      "in_ydb": false,
      "iris_section": "",
      "name": "ASTART",
      "pragmatic_tier": "ansi-unimplemented",
      "standard_status": "ansi",
      "ydb_section": ""
    },
    {
      "anno_section": "pages/a108022.html#8.2.4",
      "concept": "commands",
      "in_anno": true,
      "in_iris": false,
      "in_ydb": false,
      "iris_section": "",
      "name": "ASTOP",
      "pragmatic_tier": "ansi-unimplemented",
      "standard_status": "ansi",
      "ydb_section": ""
    },
    {
      "anno_section": "pages/a108023.html#8.2.5",
      "concept": "commands",
      "in_anno": true,
      "in_iris": false,
      "in_ydb": false,
      "iris_section": "",
      "name": "AUNBLOCK",
      "pragmatic_tier": "ansi-unimplemented",
      "standard_status": "ansi",
      "ydb_section": ""
    },
    {
      "anno_section": "pages/a108024.html#8.2.1",
      "concept": "commands",
      "in_anno": true,
      "in_iris": true,
      "in_ydb": true,
      "iris_section": "site/RCOS_cbreak.html#RCOS_cbreak",
      "name": "BREAK",
      "pragmatic_tier": "core",
      "standard_status": "ansi",
      "ydb_section": "ProgrammersGuide/commands.rst#Break"
    },
    {
      "anno_section": "",
      "concept": "commands",
      "in_anno": false,
      "in_iris": true,
      "in_ydb": false,
      "iris_section": "site/RCOS_ccatch.html#RCOS_ccatch",
      "name": "CATCH",
      "pragmatic_tier": "iris-only",
      "standard_status": "iris-extension",
      "ydb_section": ""
    },
    {
      "anno_section": "pages/a108025.html#8.2.2",
      "concept": "commands",
      "in_anno": true,
      "in_iris": true,
      "in_ydb": true,
      "iris_section": "site/RCOS_cclose.html#RCOS_cclose",
      "name": "CLOSE",
      "pragmatic_tier": "core",
      "standard_status": "ansi",
      "ydb_section": "ProgrammersGuide/commands.rst#Close"
    },
    {
      "anno_section": "",
      "concept": "commands",
      "in_anno": false,
      "in_iris": true,
      "in_ydb": false,
      "iris_section": "site/RCOS_ccontinue.html#RCOS_ccontinue",
      "name": "CONTINUE",
      "pragmatic_tier": "iris-only",
      "standard_status": "iris-extension",
      "ydb_section": ""
    },
    {
      "anno_section": "pages/a108026.html#8.2.3",
      "concept": "commands",
      "in_anno": true,
      "in_iris": true,
      "in_ydb": true,
      "iris_section": "site/RCOS_cdo.html#RCOS_cdo",
      "name": "DO",
      "pragmatic_tier": "core",
      "standard_status": "ansi",
      "ydb_section": "ProgrammersGuide/commands.rst#Do"
    },
    {
      "anno_section": "pages/a108027.html#8.2.4",
      "concept": "commands",
      "in_anno": true,
      "in_iris": true,
      "in_ydb": true,
      "iris_section": "site/RCOS_celse.html#RCOS_celse",
      "name": "ELSE",
      "pragmatic_tier": "core",
      "standard_status": "ansi",
      "ydb_section": "ProgrammersGuide/commands.rst#Else"
    },
    {
      "anno_section": "",
      "concept": "commands",
      "in_anno": false,
      "in_iris": true,
      "in_ydb": false,
      "iris_section": "site/RCOS_celseif.html#RCOS_celseif",
      "name": "ELSEIF",
      "pragmatic_tier": "iris-only",
      "standard_status": "iris-extension",
      "ydb_section": ""
    },
    {
      "anno_section": "pages/a108028.html#8.2.10",
      "concept": "commands",
      "in_anno": true,
      "in_iris": false,
      "in_ydb": false,
      "iris_section": "",
      "name": "ESTART",
      "pragmatic_tier": "ansi-unimplemented",
      "standard_status": "ansi",
      "ydb_section": ""
    },
    {
      "anno_section": "pages/a108029.html#8.2.11",
      "concept": "commands",
      "in_anno": true,
      "in_iris": false,
      "in_ydb": false,
      "iris_section": "",
      "name": "ESTOP",
      "pragmatic_tier": "ansi-unimplemented",
      "standard_status": "ansi",
      "ydb_section": ""
    },
    {
      "anno_section": "pages/a108030.html#8.2.12",
      "concept": "commands",
      "in_anno": true,
      "in_iris": false,
      "in_ydb": false,
      "iris_section": "",
      "name": "ETRIGGER",
      "pragmatic_tier": "ansi-unimplemented",
      "standard_status": "ansi",
      "ydb_section": ""
    },
    {
      "anno_section": "pages/a108031.html#8.2.5",
      "concept": "commands",
      "in_anno": true,
      "in_iris": true,
      "in_ydb": true,
      "iris_section": "site/RCOS_cfor.html#RCOS_cfor",
      "name": "FOR",
      "pragmatic_tier": "core",
      "standard_status": "ansi",
      "ydb_section": "ProgrammersGuide/commands.rst#For"
    },
    {
      "anno_section": "pages/a108032.html#8.2.6",
      "concept": "commands",
      "in_anno": true,
      "in_iris": true,
      "in_ydb": true,
      "iris_section": "site/RCOS_cgoto.html#RCOS_cgoto",
      "name": "GOTO",
      "pragmatic_tier": "core",
      "standard_status": "ansi",
      "ydb_section": "ProgrammersGuide/commands.rst#Goto"
    },
    {
      "anno_section": "pages/a108033.html#8.2.7",
      "concept": "commands",
      "in_anno": true,
      "in_iris": true,
      "in_ydb": true,
      "iris_section": "site/RCOS_chalt.html#RCOS_chalt",
      "name": "HALT",
      "pragmatic_tier": "core",
      "standard_status": "ansi",
      "ydb_section": "ProgrammersGuide/commands.rst#HALT"
    },
    {
      "anno_section": "pages/a108034.html#8.2.8",
      "concept": "commands",
      "in_anno": true,
      "in_iris": true,
      "in_ydb": true,
      "iris_section": "site/RCOS_chang.html#RCOS_chang",
      "name": "HANG",
      "pragmatic_tier": "core",
      "standard_status": "ansi",
      "ydb_section": "ProgrammersGuide/commands.rst#HANG"
    },
    {
      "anno_section": "pages/a108035.html#8.2.9",
      "concept": "commands",
      "in_anno": true,
      "in_iris": true,
      "in_ydb": true,
      "iris_section": "site/RCOS_cif.html#RCOS_cif",
      "name": "IF",
      "pragmatic_tier": "core",
      "standard_status": "ansi",
      "ydb_section": "ProgrammersGuide/commands.rst#If"
    },
    {
      "anno_section": "pages/a108036.html#8.2.10",
      "concept": "commands",
      "in_anno": true,
      "in_iris": true,
      "in_ydb": true,
      "iris_section": "site/RCOS_cjob.html#RCOS_cjob",
      "name": "JOB",
      "pragmatic_tier": "core",
      "standard_status": "ansi",
      "ydb_section": "ProgrammersGuide/commands.rst#Job"
    },
    {
      "anno_section": "pages/a108037.html#8.2.11",
      "concept": "commands",
      "in_anno": true,
      "in_iris": true,
      "in_ydb": true,
      "iris_section": "site/RCOS_ckill.html#RCOS_ckill",
      "name": "KILL",
      "pragmatic_tier": "core",
      "standard_status": "ansi",
      "ydb_section": "ProgrammersGuide/commands.rst#Kill"
    },
    {
      "anno_section": "pages/a108038.html#8.2.20",
      "concept": "commands",
      "in_anno": true,
      "in_iris": false,
      "in_ydb": false,
      "iris_section": "",
      "name": "KSUBSCRIPTS",
      "pragmatic_tier": "ansi-unimplemented",
      "standard_status": "ansi",
      "ydb_section": ""
    },
    {
      "anno_section": "pages/a108039.html#8.2.21",
      "concept": "commands",
      "in_anno": true,
      "in_iris": false,
      "in_ydb": false,
      "iris_section": "",
      "name": "KVALUE",
      "pragmatic_tier": "ansi-unimplemented",
      "standard_status": "ansi",
      "ydb_section": ""
    },
    {
      "anno_section": "pages/a108040.html#8.2.12",
      "concept": "commands",
      "in_anno": true,
      "in_iris": true,
      "in_ydb": true,
      "iris_section": "site/RCOS_clock.html#RCOS_clock",
      "name": "LOCK",
      "pragmatic_tier": "core",
      "standard_status": "ansi",
      "ydb_section": "ProgrammersGuide/commands.rst#Lock"
    },
    {
      "anno_section": "pages/a108041.html#8.2.13",
      "concept": "commands",
      "in_anno": true,
      "in_iris": true,
      "in_ydb": true,
      "iris_section": "site/RCOS_cmerge.html#RCOS_cmerge",
      "name": "MERGE",
      "pragmatic_tier": "core",
      "standard_status": "ansi",
      "ydb_section": "ProgrammersGuide/commands.rst#Merge"
    },
    {
      "anno_section": "pages/a108042.html#8.2.14",
      "concept": "commands",
      "in_anno": true,
      "in_iris": true,
      "in_ydb": true,
      "iris_section": "site/RCOS_cnew.html#RCOS_cnew",
      "name": "NEW",
      "pragmatic_tier": "core",
      "standard_status": "ansi",
      "ydb_section": "ProgrammersGuide/commands.rst#New"
    },
    {
      "anno_section": "pages/a108043.html#8.2.15",
      "concept": "commands",
      "in_anno": true,
      "in_iris": true,
      "in_ydb": true,
      "iris_section": "site/RCOS_copen.html#RCOS_copen",
      "name": "OPEN",
      "pragmatic_tier": "core",
      "standard_status": "ansi",
      "ydb_section": "ProgrammersGuide/commands.rst#Open"
    },
    {
      "anno_section": "",